{"clusterGroups":2,"elapsedNanos":44993375577,"error":"java.lang.IllegalStateException: owned member failed","memberProcesses":6,"ownerProcessId":12484,"profileSha256":"02ef0ee44900e1a472fea03ed5cb406215550994826b53f4b708e33815c6be9d","publisherProcesses":3,"rawFiles":[{"purpose":"setup","rawBytes":25532,"rawFile":"raw/m14/bundles/setup.jsonl.gz","rawSha256":"0dace1280cb7e30db2baa6acb1c9b100bd5a26b9a5fe44f1a8598ac9003dab8b"},{"purpose":"M14-C01-APPLY-BEFORE-PUBLISH","rawBytes":32963,"rawFile":"raw/m14/bundles/M14-C01-APPLY-BEFORE-PUBLISH.jsonl.gz","rawSha256":"93713eafaa8d1212a974851d482dd7882afd1ae3aa867c65bb223dff7aed89af"},{"purpose":"M14-C02-DURABLE-WRITE-BEFORE-ACK-LOSS","rawBytes":50664,"rawFile":"raw/m14/bundles/M14-C02-DURABLE-WRITE-BEFORE-ACK-LOSS.jsonl.gz","rawSha256":"913f791d5bb48635376ed96da38aeac6dbaee50d2ebb78c72a3d08c423160767"},{"purpose":"M14-C03-DURABLE-ACK-BEFORE-REPLICATION","rawBytes":37522,"rawFile":"raw/m14/bundles/M14-C03-DURABLE-ACK-BEFORE-REPLICATION.jsonl.gz","rawSha256":"5b1d02381a6533dae53581f37e84a9f3f9e2f796abec59513466f67a3df04b79"},{"purpose":"M14-C04-LIVE-STALE-PUBLISHER","rawBytes":40139,"rawFile":"raw/m14/bundles/M14-C04-LIVE-STALE-PUBLISHER.jsonl.gz","rawSha256":"860f4da30c46498da9099db705fed04125dd309c44720276449ac038e29ff010"},{"purpose":"M14-C05-EXECUTION-FULL-SHARD-ISOLATION","rawBytes":491526,"rawFile":"raw/m14/bundles/M14-C05-EXECUTION-FULL-SHARD-ISOLATION.jsonl.gz","rawSha256":"56ca125874a3526cf2e6d7d7e142f75e4cd86ba098446a17bfb2ccc4b488aa6d"},{"purpose":"M14-C06-SNAPSHOT-ALL-MEMBERS-AND-SINK-RESTART","rawBytes":472810,"rawFile":"raw/m14/bundles/M14-C06-SNAPSHOT-ALL-MEMBERS-AND-SINK-RESTART.jsonl.gz","rawSha256":"1abd3fa753c3c415da90a47f9b1c0f6ac8d393131fa78e21d4643ecef14e42af"},{"purpose":"teardown","rawBytes":413113,"rawFile":"raw/m14/bundles/teardown.jsonl.gz","rawSha256":"1189172358ee00524cd015308b2b75fd092ca13c15182553e399cff3f63eae6d"}],"scenarios":[{"assertions":["APPLIED_BATCH_SAME_BYTES_AFTER_FAILOVER","ONE_DURABLE_SINK_ACCEPTANCE","ORIGINAL_RETRY_NO_NEW_OUTPUT"],"elapsedNanos":11277519356,"id":"M14-C01-APPLY-BEFORE-PUBLISH","rawFiles":[{"purpose":"M14-C01-APPLY-BEFORE-PUBLISH","rawBytes":32963,"rawFile":"raw/m14/bundles/M14-C01-APPLY-BEFORE-PUBLISH.jsonl.gz","rawSha256":"93713eafaa8d1212a974851d482dd7882afd1ae3aa867c65bb223dff7aed89af"}],"status":"PASS"},{"assertions":["FORCED_FRONTIER_SURVIVES","DUPLICATE_DELIVERY_SINGLE_ACCEPTANCE","REPLICATED_CURSOR_NOT_PREMATURE"],"elapsedNanos":1798451615,"id":"M14-C02-DURABLE-WRITE-BEFORE-ACK-LOSS","rawFiles":[{"purpose":"M14-C02-DURABLE-WRITE-BEFORE-ACK-LOSS","rawBytes":50664,"rawFile":"raw/m14/bundles/M14-C02-DURABLE-WRITE-BEFORE-ACK-LOSS.jsonl.gz","rawSha256":"913f791d5bb48635376ed96da38aeac6dbaee50d2ebb78c72a3d08c423160767"}],"status":"PASS"},{"assertions":["ACTUAL_ACK_RECEIVED","NO_ACK_CONTROL_SUBMITTED_BEFORE_CRASH","OUTBOX_RETAINED_UNTIL_VALID_REPLICATED_ACK"],"elapsedNanos":1740025316,"id":"M14-C03-DURABLE-ACK-BEFORE-REPLICATION","rawFiles":[{"purpose":"M14-C03-DURABLE-ACK-BEFORE-REPLICATION","rawBytes":37522,"rawFile":"raw/m14/bundles/M14-C03-DURABLE-ACK-BEFORE-REPLICATION.jsonl.gz","rawSha256":"5b1d02381a6533dae53581f37e84a9f3f9e2f796abec59513466f67a3df04b79"}],"status":"PASS"},{"assertions":["OLD_PID_ALIVE_AT_BOTH_ATTEMPTS","STALE_DATA_REJECTED_AFTER_ADMIN_OK","STALE_ACK_NO_CURSOR_OR_EVICTION_DELTA","NEW_AUTHORITY_SAME_STABLE_BATCH_BYTES","HIGHER_DATA_EPOCH_DOES_NOT_SELF_AUTHORIZE"],"elapsedNanos":2099445267,"id":"M14-C04-LIVE-STALE-PUBLISHER","rawFiles":[{"purpose":"M14-C04-LIVE-STALE-PUBLISHER","rawBytes":40139,"rawFile":"raw/m14/bundles/M14-C04-LIVE-STALE-PUBLISHER.jsonl.gz","rawSha256":"860f4da30c46498da9099db705fed04125dd309c44720276449ac038e29ff010"}],"status":"PASS"},{"assertions":["FULL_SHARD1_NO_PARTIAL_APPLY","SHARD2_ACTUAL_PROGRESS","CONTROL_CAN_DRAIN_FULL_OUTBOX","REFUSED_ID_FIRST_APPLIES_ONCE"],"elapsedNanos":4114880519,"id":"M14-C05-EXECUTION-FULL-SHARD-ISOLATION","rawFiles":[{"purpose":"M14-C05-EXECUTION-FULL-SHARD-ISOLATION","rawBytes":491526,"rawFile":"raw/m14/bundles/M14-C05-EXECUTION-FULL-SHARD-ISOLATION.jsonl.gz","rawSha256":"56ca125874a3526cf2e6d7d7e142f75e4cd86ba098446a17bfb2ccc4b488aa6d"}],"status":"PASS"},{"assertions":[],"elapsedNanos":13251208065,"id":"M14-C06-SNAPSHOT-ALL-MEMBERS-AND-SINK-RESTART","rawFiles":[{"purpose":"M14-C06-SNAPSHOT-ALL-MEMBERS-AND-SINK-RESTART","rawBytes":472810,"rawFile":"raw/m14/bundles/M14-C06-SNAPSHOT-ALL-MEMBERS-AND-SINK-RESTART.jsonl.gz","rawSha256":"1abd3fa753c3c415da90a47f9b1c0f6ac8d393131fa78e21d4643ecef14e42af"}],"status":"SYSTEM_ERROR"}],"schemaVersion":"matching.m14.cluster-faults.v1","sinkProcesses":1,"startedAtEpochMillis":1788858385266,"status":"SYSTEM_ERROR","teardownComplete":true,"teardownElapsedNanos":62503384}
