{"clusterGroups":2,"elapsedNanos":58010108292,"error":"","memberProcesses":6,"ownerProcessId":99936,"profileSha256":"02ef0ee44900e1a472fea03ed5cb406215550994826b53f4b708e33815c6be9d","publisherProcesses":3,"rawFiles":[{"purpose":"setup","rawBytes":25149,"rawFile":"raw/m14/bundles/setup.jsonl.gz","rawSha256":"ebba2bdaf69819e2e313132f6345d8d55101a6cfa63adfb90662befc6df25654"},{"purpose":"M14-C01-APPLY-BEFORE-PUBLISH","rawBytes":33140,"rawFile":"raw/m14/bundles/M14-C01-APPLY-BEFORE-PUBLISH.jsonl.gz","rawSha256":"45c4c09dd0988e02c4ea50f7fcb087358d451e753f34db11f7567565b7556e17"},{"purpose":"M14-C02-DURABLE-WRITE-BEFORE-ACK-LOSS","rawBytes":50387,"rawFile":"raw/m14/bundles/M14-C02-DURABLE-WRITE-BEFORE-ACK-LOSS.jsonl.gz","rawSha256":"4ed61948f8a065ac7a33958804c384abc07e13b1a567db9bd13e1940695cd061"},{"purpose":"M14-C03-DURABLE-ACK-BEFORE-REPLICATION","rawBytes":37499,"rawFile":"raw/m14/bundles/M14-C03-DURABLE-ACK-BEFORE-REPLICATION.jsonl.gz","rawSha256":"61da048d2f0569b6920620d4bc83207acab08ae3545aa6e7c83bcdfa004b8900"},{"purpose":"M14-C04-LIVE-STALE-PUBLISHER","rawBytes":39910,"rawFile":"raw/m14/bundles/M14-C04-LIVE-STALE-PUBLISHER.jsonl.gz","rawSha256":"ec778230974c7fd87bc41fbda362e9ab70e036ebbd370fe1ee275790e74ca0ee"},{"purpose":"M14-C05-EXECUTION-FULL-SHARD-ISOLATION","rawBytes":492309,"rawFile":"raw/m14/bundles/M14-C05-EXECUTION-FULL-SHARD-ISOLATION.jsonl.gz","rawSha256":"4f9d733f9885b36f8565c485666c0cab890c90b884d14a77327333427344a135"},{"purpose":"M14-C06-SNAPSHOT-ALL-MEMBERS-AND-SINK-RESTART","rawBytes":1159640,"rawFile":"raw/m14/bundles/M14-C06-SNAPSHOT-ALL-MEMBERS-AND-SINK-RESTART.jsonl.gz","rawSha256":"0d0539b64dfb9c71ba29fc0f3438784100bcd36c684341bf08da555959023688"},{"purpose":"M14-C07-FRAGMENTED-BATCH-AND-MARKET-REBUILD","rawBytes":1856994,"rawFile":"raw/m14/bundles/M14-C07-FRAGMENTED-BATCH-AND-MARKET-REBUILD.jsonl.gz","rawSha256":"0fdcfecf6932cf7ada515c46b9a9921ad0f72d621089ae502073680c6f4ee7c0"},{"purpose":"teardown","rawBytes":2505489,"rawFile":"raw/m14/bundles/teardown.jsonl.gz","rawSha256":"170ba45fee0319f4dc4a9a4e1b826376cc6d10659d831479e6aeb05bd112d0bd"}],"scenarios":[{"assertions":["APPLIED_BATCH_SAME_BYTES_AFTER_FAILOVER","ONE_DURABLE_SINK_ACCEPTANCE","ORIGINAL_RETRY_NO_NEW_OUTPUT"],"elapsedNanos":11178157583,"id":"M14-C01-APPLY-BEFORE-PUBLISH","rawFiles":[{"purpose":"M14-C01-APPLY-BEFORE-PUBLISH","rawBytes":33140,"rawFile":"raw/m14/bundles/M14-C01-APPLY-BEFORE-PUBLISH.jsonl.gz","rawSha256":"45c4c09dd0988e02c4ea50f7fcb087358d451e753f34db11f7567565b7556e17"}],"status":"PASS"},{"assertions":["FORCED_FRONTIER_SURVIVES","DUPLICATE_DELIVERY_SINGLE_ACCEPTANCE","REPLICATED_CURSOR_NOT_PREMATURE"],"elapsedNanos":1200300292,"id":"M14-C02-DURABLE-WRITE-BEFORE-ACK-LOSS","rawFiles":[{"purpose":"M14-C02-DURABLE-WRITE-BEFORE-ACK-LOSS","rawBytes":50387,"rawFile":"raw/m14/bundles/M14-C02-DURABLE-WRITE-BEFORE-ACK-LOSS.jsonl.gz","rawSha256":"4ed61948f8a065ac7a33958804c384abc07e13b1a567db9bd13e1940695cd061"}],"status":"PASS"},{"assertions":["ACTUAL_ACK_RECEIVED","NO_ACK_CONTROL_SUBMITTED_BEFORE_CRASH","OUTBOX_RETAINED_UNTIL_VALID_REPLICATED_ACK"],"elapsedNanos":953960916,"id":"M14-C03-DURABLE-ACK-BEFORE-REPLICATION","rawFiles":[{"purpose":"M14-C03-DURABLE-ACK-BEFORE-REPLICATION","rawBytes":37499,"rawFile":"raw/m14/bundles/M14-C03-DURABLE-ACK-BEFORE-REPLICATION.jsonl.gz","rawSha256":"61da048d2f0569b6920620d4bc83207acab08ae3545aa6e7c83bcdfa004b8900"}],"status":"PASS"},{"assertions":["OLD_PID_ALIVE_AT_BOTH_ATTEMPTS","STALE_DATA_REJECTED_AFTER_ADMIN_OK","STALE_ACK_NO_CURSOR_OR_EVICTION_DELTA","NEW_AUTHORITY_SAME_STABLE_BATCH_BYTES","HIGHER_DATA_EPOCH_DOES_NOT_SELF_AUTHORIZE"],"elapsedNanos":1185200000,"id":"M14-C04-LIVE-STALE-PUBLISHER","rawFiles":[{"purpose":"M14-C04-LIVE-STALE-PUBLISHER","rawBytes":39910,"rawFile":"raw/m14/bundles/M14-C04-LIVE-STALE-PUBLISHER.jsonl.gz","rawSha256":"ec778230974c7fd87bc41fbda362e9ab70e036ebbd370fe1ee275790e74ca0ee"}],"status":"PASS"},{"assertions":["FULL_SHARD1_NO_PARTIAL_APPLY","SHARD2_ACTUAL_PROGRESS","CONTROL_CAN_DRAIN_FULL_OUTBOX","REFUSED_ID_FIRST_APPLIES_ONCE"],"elapsedNanos":2807549917,"id":"M14-C05-EXECUTION-FULL-SHARD-ISOLATION","rawFiles":[{"purpose":"M14-C05-EXECUTION-FULL-SHARD-ISOLATION","rawBytes":492309,"rawFile":"raw/m14/bundles/M14-C05-EXECUTION-FULL-SHARD-ISOLATION.jsonl.gz","rawSha256":"4f9d733f9885b36f8565c485666c0cab890c90b884d14a77327333427344a135"}],"status":"PASS"},{"assertions":["SIX_ACTUAL_SNAPSHOT_LOADS","EXACT_SUFFIX_STATE_OUTPUT_CURSOR_GRANT_PROFILE","DURABLE_SINK_JOURNAL_RECONSTRUCTION","ORIGINAL_REQUEST_CONTROL_RETRY","OWNED_PROCESSES_TEARDOWN"],"elapsedNanos":17504917667,"id":"M14-C06-SNAPSHOT-ALL-MEMBERS-AND-SINK-RESTART","rawFiles":[{"purpose":"M14-C06-SNAPSHOT-ALL-MEMBERS-AND-SINK-RESTART","rawBytes":1159640,"rawFile":"raw/m14/bundles/M14-C06-SNAPSHOT-ALL-MEMBERS-AND-SINK-RESTART.jsonl.gz","rawSha256":"0d0539b64dfb9c71ba29fc0f3438784100bcd36c684341bf08da555959023688"}],"status":"PASS"},{"assertions":["REAL_APPLIED_LARGE_BATCH","REAL_WHOLE_SHARD_LARGE_SNAPSHOT","AT_LEAST_TWO_APPLICATION_FRAGMENTS_EACH","REASSEMBLED_BYTES_MATCH_SOURCE","SNAPSHOT_NOT_IN_BATCH_QUEUE","PARTIAL_MESSAGE_NO_CURSOR"],"elapsedNanos":17241716167,"id":"M14-C07-FRAGMENTED-BATCH-AND-MARKET-REBUILD","rawFiles":[{"purpose":"M14-C07-FRAGMENTED-BATCH-AND-MARKET-REBUILD","rawBytes":1856994,"rawFile":"raw/m14/bundles/M14-C07-FRAGMENTED-BATCH-AND-MARKET-REBUILD.jsonl.gz","rawSha256":"0fdcfecf6932cf7ada515c46b9a9921ad0f72d621089ae502073680c6f4ee7c0"}],"status":"PASS"}],"schemaVersion":"matching.m14.cluster-faults.v1","sinkProcesses":1,"startedAtEpochMillis":1788787455422,"status":"PASS","teardownComplete":true,"teardownElapsedNanos":706938875}
